{
  "from": "LandingPageBuilder",
  "to": "LeadValidator",
  "timestamp": "2026-02-12T10:11:33.979983",
  "version": 1,
  "summary": {
    "status": "complete",
    "deliverables": [
      "https://pac-holding.com deployed"
    ],
    "metrics_delta": {
      "landing_page_status": "live"
    },
    "blockers": [],
    "next_steps": [
      "Validate top 50 leads"
    ],
    "context_notes": "Domain propagated within 2 min.",
    "assumptions": [
      "Timezone is America/Chicago for all bookings",
      "Lead validation expects HVAC businesses with websites",
      "Phone numbers should be main booking lines, not corporate"
    ]
  }
}