{
  "from": "LandingPageBuilder",
  "to": "LeadValidator",
  "timestamp": "2026-02-12T10:08:58.879524",
  "version": 1,
  "summary": {
    "status": "complete",
    "deliverables": [
      "https://pac-holding.com deployed",
      "Lead capture form live"
    ],
    "metrics_delta": {
      "landing_page_status": "live"
    },
    "blockers": [],
    "next_steps": [
      "Validate top 50 leads",
      "Cross-reference phone numbers"
    ],
    "context_notes": "Domain propagated within 2 min. Form submits to JSON file."
  }
}